{
  "schema_version": 1,
  "point_group_registry_sha256": "d332b5549cd76246bb60917a75e1e175b7486d559d5eed38c3202f88dc8d93a5",
  "operation_catalog_sha256": "8bd24914eb8ac7d0796a8b778be6ab8c109a75838816c3d623ca6bcf991404b7",
  "generated_by": "scripts/generate_optical_response_invariants.py",
  "conventions": {
    "equivariance": "A(R) T = T B(R)",
    "output": "polar Cartesian vector with A(R)=D(R)",
    "symmetric_input": "M_+(R) on (xx, yy, zz, xy, xz, yz); off-diagonal entries are full sums",
    "antisymmetric_input": "M_-(R) on h=i E x E*",
    "scope": "spatial point-group selection rules only; no microscopic, time-reversal, frequency, or unit constraints"
  },
  "point_groups": [
    {
      "number": 1,
      "hm_symbol": "1",
      "schoenflies_symbol": "C1",
      "centrosymmetric": false,
      "responses": {
        "shift_current": {
          "response": "shift_current",
          "shape": [
            3,
            6
          ],
          "dimension": 18,
          "output_basis": [
            "x",
            "y",
            "z"
          ],
          "input_basis": [
            "xx",
            "yy",
            "zz",
            "xy",
            "xz",
            "yz"
          ],
          "equation": "J^a(0) = sigma^{a;bc} E^b E^{c*}; sigma^{a;bc}=sigma^{a;cb}",
          "basis": [
            [
              [
                1,
                0,
                0,
                0,
                0,
                0
              ],
              [
                0,
                0,
                0,
                0,
                0,
                0
              ],
              [
                0,
                0,
                0,
                0,
                0,
                0
              ]
            ],
            [
              [
                0,
                1,
                0,
                0,
                0,
                0
              ],
              [
                0,
                0,
                0,
                0,
                0,
                0
              ],
              [
                0,
                0,
                0,
                0,
                0,
                0
              ]
            ],
            [
              [
                0,
                0,
                1,
                0,
                0,
                0
              ],
              [
                0,
                0,
                0,
                0,
                0,
                0
              ],
              [
                0,
                0,
                0,
                0,
                0,
                0
              ]
            ],
            [
              [
                0,
                0,
                0,
                1,
                0,
                0
              ],
              [
                0,
                0,
                0,
                0,
                0,
                0
              ],
              [
                0,
                0,
                0,
                0,
                0,
                0
              ]
            ],
            [
              [
                0,
                0,
                0,
                0,
                1,
                0
              ],
              [
                0,
                0,
                0,
                0,
                0,
                0
              ],
              [
                0,
                0,
                0,
                0,
                0,
                0
              ]
            ],
            [
              [
                0,
                0,
                0,
                0,
                0,
                1
              ],
              [
                0,
                0,
                0,
                0,
                0,
                0
              ],
              [
                0,
                0,
                0,
                0,
                0,
                0
              ]
            ],
            [
              [
                0,
                0,
                0,
                0,
                0,
                0
              ],
              [
                1,
                0,
                0,
                0,
                0,
                0
              ],
              [
                0,
                0,
                0,
                0,
                0,
                0
              ]
            ],
            [
              [
                0,
                0,
                0,
                0,
                0,
                0
              ],
              [
                0,
                1,
                0,
                0,
                0,
                0
              ],
              [
                0,
                0,
                0,
                0,
                0,
                0
              ]
            ],
            [
              [
                0,
                0,
                0,
                0,
                0,
                0
              ],
              [
                0,
                0,
                1,
                0,
                0,
                0
              ],
              [
                0,
                0,
                0,
                0,
                0,
                0
              ]
            ],
            [
              [
                0,
                0,
                0,
                0,
                0,
                0
              ],
              [
                0,
                0,
                0,
                1,
                0,
                0
              ],
              [
                0,
                0,
                0,
                0,
                0,
                0
              ]
            ],
            [
              [
                0,
                0,
                0,
                0,
                0,
                0
              ],
              [
                0,
                0,
                0,
                0,
                1,
                0
              ],
              [
                0,
                0,
                0,
                0,
                0,
                0
              ]
            ],
            [
              [
                0,
                0,
                0,
                0,
                0,
                0
              ],
              [
                0,
                0,
                0,
                0,
                0,
                1
              ],
              [
                0,
                0,
                0,
                0,
                0,
                0
              ]
            ],
            [
              [
                0,
                0,
                0,
                0,
                0,
                0
              ],
              [
                0,
                0,
                0,
                0,
                0,
                0
              ],
              [
                1,
                0,
                0,
                0,
                0,
                0
              ]
            ],
            [
              [
                0,
                0,
                0,
                0,
                0,
                0
              ],
              [
                0,
                0,
                0,
                0,
                0,
                0
              ],
              [
                0,
                1,
                0,
                0,
                0,
                0
              ]
            ],
            [
              [
                0,
                0,
                0,
                0,
                0,
                0
              ],
              [
                0,
                0,
                0,
                0,
                0,
                0
              ],
              [
                0,
                0,
                1,
                0,
                0,
                0
              ]
            ],
            [
              [
                0,
                0,
                0,
                0,
                0,
                0
              ],
              [
                0,
                0,
                0,
                0,
                0,
                0
              ],
              [
                0,
                0,
                0,
                1,
                0,
                0
              ]
            ],
            [
              [
                0,
                0,
                0,
                0,
                0,
                0
              ],
              [
                0,
                0,
                0,
                0,
                0,
                0
              ],
              [
                0,
                0,
                0,
                0,
                1,
                0
              ]
            ],
            [
              [
                0,
                0,
                0,
                0,
                0,
                0
              ],
              [
                0,
                0,
                0,
                0,
                0,
                0
              ],
              [
                0,
                0,
                0,
                0,
                0,
                1
              ]
            ]
          ]
        },
        "shg": {
          "response": "shg",
          "shape": [
            3,
            6
          ],
          "dimension": 18,
          "output_basis": [
            "x",
            "y",
            "z"
          ],
          "input_basis": [